{
  "accepted_proof_manifest_digest": "df47eda3dff2f2d4491afab71574a9abefe02e1ba1af3a788f3c190ab650a5ad",
  "accepted_reconciliation_digest": "0415ceec67d08af7eb2cc3335f6d2dd2542a313297f53883b5a788af32add19e",
  "contract_version": "1.0.0",
  "execution_proof_manifest_digest": "3f9820894bcd62ac92db48b10c9a128440f20096129cac0c83b06b957e7488a9",
  "execution_reconciliation_digest": "0415ceec67d08af7eb2cc3335f6d2dd2542a313297f53883b5a788af32add19e",
  "frontier": {
    "kind": "postgres_lsn",
    "value": "0/194FE20"
  },
  "gate_ids": [
    "continuity",
    "schema",
    "deletes",
    "reconciliation",
    "lag",
    "pre_migration",
    "rollback_readiness",
    "evidence_integrity"
  ],
  "generation_id": "generation-34edddda5aee96dc7236aaf3",
  "physical_identity_relation": "FRESH_EXECUTION_BOUND_MATERIALIZATION",
  "publication_binding_digest": "fe23045680a240e34e9e962c082407fadb53ed03087591455dc44dee3e8e0e0f",
  "record_type": "publication_binding_manifest",
  "reuses_vanished_stage6_snapshots": false,
  "schema_set_digest": "5bfe6ecf0e7576a91f9e1a8aed715b7653d3aa98009162b65dc8a5f2bff93979",
  "table_map": {
    "order_items": {
      "identifier": "stage23.cb_g_017d6eea93a471d8.order_items",
      "manifest_list_digest": "0a83a2d4ccaba315a74be9403e740295f524f5411e230b63780ddd50c875f8e1",
      "row_count": 66,
      "snapshot_id": "9181776194235418564"
    },
    "orders": {
      "identifier": "stage23.cb_g_017d6eea93a471d8.orders",
      "manifest_list_digest": "e1ee2a7e74c0659560aa26a8c94c4bc58332ab4419a2d60f815a46b2e1df4d8b",
      "row_count": 6,
      "snapshot_id": "5164862605917836293"
    }
  },
  "table_map_digest": "91d02e198cb3d843c5441361c9eb65ba1aba74117d1a8e8338a90ff3a02e2f84"
}
